{
  "version": 1,
  "status": "complete",
  "sources": [{ "ref": "test.dc.html", "kind": "html-deck", "hash": "sha256:0000000000000000000000000000000000000000000000000000000000000001", "slug": "test", "frames": ["test/01", "test/02"] }],
  "frames": [{ "id": "test/01", "png": "test/01.png", "source": "test.dc.html", "shows": [] }, { "id": "test/02", "png": "test/02.png", "source": "test.dc.html", "shows": [] }],
  "screens": [
    { "name": "Home1", "route": "/", "states": [{ "name": "default", "frames": ["test/01"] }], "composes": [] },
    { "name": "Home2", "route": "/", "states": [{ "name": "default", "frames": ["test/02"] }], "composes": [] }
  ],
  "organisms": [],
  "molecules": [],
  "atoms": []
}
