{
  "version": 1,
  "status": "complete",
  "sources": [
    {
      "ref": "test.dc.html",
      "kind": "html-deck",
      "hash": "sha256:0000000000000000000000000000000000000000000000000000000000000001",
      "slug": "test",
      "frames": ["test/01", "test/02", "test/03"]
    }
  ],
  "frames": [
    { "id": "test/01", "png": "test/01.png", "source": "test.dc.html", "shows": ["Button"] },
    { "id": "test/02", "png": "test/02.png", "source": "test.dc.html", "shows": ["Button"] },
    { "id": "test/03", "png": "test/03.png", "source": "test.dc.html", "shows": [] }
  ],
  "screens": [
    {
      "name": "Home",
      "route": "/",
      "states": [
        { "name": "default", "frames": ["test/01"] }
      ],
      "composes": ["Button"]
    }
  ],
  "organisms": [],
  "molecules": [],
  "atoms": [
    { "name": "Button", "appears_on": ["test/02"] }
  ]
}
